{
  "schemaVersion": "1.0.0",
  "modelVersion": "synthetic-appearance-v1",
  "status": "VALIDATED_RELEASE",
  "referenceModel": "MALE",
  "enabledMetricIds": [
    "h",
    "d",
    "a",
    "appearance.brow",
    "appearance.texture"
  ],
  "categories": {
    "HARMONY": {
      "weight": 0.25,
      "minimumCoverage": 1
    },
    "DIMORPHISM": {
      "weight": 0.25,
      "minimumCoverage": 1
    },
    "ANGULARITY": {
      "weight": 0.25,
      "minimumCoverage": 1
    },
    "MISC": {
      "weight": 0.25,
      "minimumCoverage": 1
    }
  },
  "metrics": [
    {
      "id": "h",
      "category": "HARMONY",
      "valueType": "RATIO",
      "formulaOrExtractorId": "fixture-geometry",
      "measurementMode": "AUTOMATIC",
      "calibrationRequired": false,
      "reliabilityStatus": "VALIDATED",
      "metricWeight": 1,
      "minimumConfidence": 0.7,
      "requiredForCompletion": true,
      "extremaEligible": false,
      "scoreScaleId": null,
      "ageApplicability": "ADULT_EVIDENCE",
      "benchmarkIds": [
        "synthetic-only"
      ],
      "tierRules": [
        {
          "tier": "T5",
          "ruleType": "VALUE_RANGE",
          "params": {
            "min": 0,
            "max": 0.199999999
          }
        },
        {
          "tier": "T4",
          "ruleType": "VALUE_RANGE",
          "params": {
            "min": 0.2,
            "max": 0.399999999
          }
        },
        {
          "tier": "T3",
          "ruleType": "VALUE_RANGE",
          "params": {
            "min": 0.4,
            "max": 0.599999999
          }
        },
        {
          "tier": "T2",
          "ruleType": "VALUE_RANGE",
          "params": {
            "min": 0.6,
            "max": 0.799999999
          }
        },
        {
          "tier": "T1",
          "ruleType": "VALUE_RANGE",
          "params": {
            "min": 0.8,
            "max": 1
          }
        }
      ],
      "scoreCurve": {
        "type": "PIECEWISE_LINEAR",
        "params": {
          "anchors": [
            {
              "value": 0,
              "score": 0
            },
            {
              "value": 1,
              "score": 100
            }
          ]
        }
      }
    },
    {
      "id": "d",
      "category": "DIMORPHISM",
      "valueType": "RATIO",
      "formulaOrExtractorId": "fixture-geometry",
      "measurementMode": "AUTOMATIC",
      "calibrationRequired": false,
      "reliabilityStatus": "VALIDATED",
      "metricWeight": 1,
      "minimumConfidence": 0.7,
      "requiredForCompletion": true,
      "extremaEligible": false,
      "scoreScaleId": null,
      "ageApplicability": "ADULT_EVIDENCE",
      "benchmarkIds": [
        "synthetic-only"
      ],
      "tierRules": [
        {
          "tier": "T5",
          "ruleType": "VALUE_RANGE",
          "params": {
            "min": 0,
            "max": 0.199999999
          }
        },
        {
          "tier": "T4",
          "ruleType": "VALUE_RANGE",
          "params": {
            "min": 0.2,
            "max": 0.399999999
          }
        },
        {
          "tier": "T3",
          "ruleType": "VALUE_RANGE",
          "params": {
            "min": 0.4,
            "max": 0.599999999
          }
        },
        {
          "tier": "T2",
          "ruleType": "VALUE_RANGE",
          "params": {
            "min": 0.6,
            "max": 0.799999999
          }
        },
        {
          "tier": "T1",
          "ruleType": "VALUE_RANGE",
          "params": {
            "min": 0.8,
            "max": 1
          }
        }
      ],
      "scoreCurve": {
        "type": "PIECEWISE_LINEAR",
        "params": {
          "anchors": [
            {
              "value": 0,
              "score": 0
            },
            {
              "value": 1,
              "score": 100
            }
          ]
        }
      }
    },
    {
      "id": "a",
      "category": "ANGULARITY",
      "valueType": "RATIO",
      "formulaOrExtractorId": "fixture-geometry",
      "measurementMode": "AUTOMATIC",
      "calibrationRequired": false,
      "reliabilityStatus": "VALIDATED",
      "metricWeight": 1,
      "minimumConfidence": 0.7,
      "requiredForCompletion": true,
      "extremaEligible": false,
      "scoreScaleId": null,
      "ageApplicability": "ADULT_EVIDENCE",
      "benchmarkIds": [
        "synthetic-only"
      ],
      "tierRules": [
        {
          "tier": "T5",
          "ruleType": "VALUE_RANGE",
          "params": {
            "min": 0,
            "max": 0.199999999
          }
        },
        {
          "tier": "T4",
          "ruleType": "VALUE_RANGE",
          "params": {
            "min": 0.2,
            "max": 0.399999999
          }
        },
        {
          "tier": "T3",
          "ruleType": "VALUE_RANGE",
          "params": {
            "min": 0.4,
            "max": 0.599999999
          }
        },
        {
          "tier": "T2",
          "ruleType": "VALUE_RANGE",
          "params": {
            "min": 0.6,
            "max": 0.799999999
          }
        },
        {
          "tier": "T1",
          "ruleType": "VALUE_RANGE",
          "params": {
            "min": 0.8,
            "max": 1
          }
        }
      ],
      "scoreCurve": {
        "type": "PIECEWISE_LINEAR",
        "params": {
          "anchors": [
            {
              "value": 0,
              "score": 0
            },
            {
              "value": 1,
              "score": 100
            }
          ]
        }
      }
    },
    {
      "id": "appearance.brow",
      "category": "MISC",
      "valueType": "CONTINUOUS_VISUAL",
      "formulaOrExtractorId": "fixture-brow",
      "measurementMode": "AUTOMATIC",
      "calibrationRequired": false,
      "reliabilityStatus": "VALIDATED",
      "metricWeight": 1,
      "minimumConfidence": 0.7,
      "requiredForCompletion": true,
      "extremaEligible": false,
      "scoreScaleId": null,
      "ageApplicability": "ADULT_EVIDENCE",
      "benchmarkIds": [
        "synthetic-only"
      ],
      "tierRules": [
        {
          "tier": "T5",
          "ruleType": "VALUE_RANGE",
          "params": {
            "min": 0,
            "max": 0.199999999
          }
        },
        {
          "tier": "T4",
          "ruleType": "VALUE_RANGE",
          "params": {
            "min": 0.2,
            "max": 0.399999999
          }
        },
        {
          "tier": "T3",
          "ruleType": "VALUE_RANGE",
          "params": {
            "min": 0.4,
            "max": 0.599999999
          }
        },
        {
          "tier": "T2",
          "ruleType": "VALUE_RANGE",
          "params": {
            "min": 0.6,
            "max": 0.799999999
          }
        },
        {
          "tier": "T1",
          "ruleType": "VALUE_RANGE",
          "params": {
            "min": 0.8,
            "max": 1
          }
        }
      ],
      "scoreCurve": {
        "type": "PIECEWISE_LINEAR",
        "params": {
          "anchors": [
            {
              "value": 0,
              "score": 0
            },
            {
              "value": 1,
              "score": 100
            }
          ]
        }
      }
    },
    {
      "id": "appearance.texture",
      "category": "MISC",
      "valueType": "CONTINUOUS_VISUAL",
      "formulaOrExtractorId": "fixture-texture",
      "measurementMode": "AUTOMATIC",
      "calibrationRequired": false,
      "reliabilityStatus": "VALIDATED",
      "metricWeight": 3,
      "minimumConfidence": 0.7,
      "requiredForCompletion": true,
      "extremaEligible": false,
      "scoreScaleId": null,
      "ageApplicability": "ADULT_EVIDENCE",
      "benchmarkIds": [
        "synthetic-only"
      ],
      "tierRules": [
        {
          "tier": "T5",
          "ruleType": "VALUE_RANGE",
          "params": {
            "min": 0,
            "max": 0.199999999
          }
        },
        {
          "tier": "T4",
          "ruleType": "VALUE_RANGE",
          "params": {
            "min": 0.2,
            "max": 0.399999999
          }
        },
        {
          "tier": "T3",
          "ruleType": "VALUE_RANGE",
          "params": {
            "min": 0.4,
            "max": 0.599999999
          }
        },
        {
          "tier": "T2",
          "ruleType": "VALUE_RANGE",
          "params": {
            "min": 0.6,
            "max": 0.799999999
          }
        },
        {
          "tier": "T1",
          "ruleType": "VALUE_RANGE",
          "params": {
            "min": 0.8,
            "max": 1
          }
        }
      ],
      "scoreCurve": {
        "type": "PIECEWISE_LINEAR",
        "params": {
          "anchors": [
            {
              "value": 0,
              "score": 0
            },
            {
              "value": 1,
              "score": 100
            }
          ]
        }
      }
    }
  ],
  "rankThresholds": null,
  "scoreScaleVersion": "fixture-scale-v1",
  "coveragePolicyVersion": "fixture-coverage-v1",
  "extremaSelectionVersion": "fixture-extrema-v1",
  "provenance": {
    "researchDatasetVersion": "SYNTHETIC_ONLY_NOT_PRODUCTION",
    "reviewState": "APPROVED",
    "approvedBy": [
      "synthetic-reviewer-a",
      "synthetic-reviewer-b"
    ],
    "notes": "Parser/scoring test fixture only. No genuine model review, aesthetic reference or fairness approval is claimed. Never ship as a runtime asset."
  }
}
